{"context":{"candidate_sha256":"a2ed5f23902bcc31e4d1f07ec640df65b97a3417e05dab44eadeb55c83298da8","format":"EVOGUARD_RELEASE_SOURCE_CONTEXT_V1","parent_commit_sha":"6e03582f29cab6183709fb36b117fe3bbd0b3586","parent_tree_sha":"8030dcb8f3e2daf7af12271dd54b80b695d2d1ad","policy_sha256":"7a9e92aa27949c962066b089046892bda4bf26891ee1b3ac49b411a825dc61a9","protected_ref":"refs/heads/main","repository":"EvoRiseKsa/EvoOM-Guard-m","repository_id":"1293651176","run_attempt":1,"run_id":"30441835115","target_commit_sha":"699c60c22445a6af54c58f31fca34edc225b98a9","target_tree_sha":"d2da75aeb1da13111c081c41c22e24bf0f16f19c","verifier_pack_sha256":"c129b33d647767db647906684fbfcc2ba834592a28b74ce4f02009984623ef43"},"format":"EVOGUARD_RELEASE_SOURCE_FINALIZER_HANDOFF_V1","record":{"sha256":"6e29b0791e9543d850df4fa051aaf3b2da25c8d934e382ea050ed72297d3598f","size":9131},"source":{"default_branch":"main","protected_ref":"refs/heads/main","repository":"EvoRiseKsa/EvoOM-Guard-m","repository_id":"1293651176","target_commit_sha":"699c60c22445a6af54c58f31fca34edc225b98a9","target_tree_sha":"d2da75aeb1da13111c081c41c22e24bf0f16f19c","workflow_run_attempt":1,"workflow_run_id":"30441835115"}}
