{"context":{"candidate_sha256":"47f546f8566b5ab52476abae6f193c12ea2937f891e412d807be4659b155b908","format":"EVOGUARD_RELEASE_SOURCE_CONTEXT_V1","parent_commit_sha":"7e20173cd7df6c7fe08e1b5cd6e76c2048abd929","parent_tree_sha":"21c0b988ea31c2cae3ce59c2dfb94d0c3978e9d4","policy_sha256":"7a9e92aa27949c962066b089046892bda4bf26891ee1b3ac49b411a825dc61a9","protected_ref":"refs/heads/main","repository":"EvoRiseKsa/EvoOM-Guard-m","repository_id":"1293651176","run_attempt":1,"run_id":"30701872897","target_commit_sha":"6bb4c328e56661b661e50532886802c6ba36a997","target_tree_sha":"bd81a595ca8608ad7da04390f31d5e489f5083ef","verifier_pack_sha256":"c129b33d647767db647906684fbfcc2ba834592a28b74ce4f02009984623ef43"},"format":"EVOGUARD_RELEASE_SOURCE_FINALIZER_HANDOFF_V1","record":{"sha256":"b69ae7d032606830b16ffc15b824eb3aed5cb8d382b3392b828109faec2a155e","size":9131},"source":{"default_branch":"main","protected_ref":"refs/heads/main","repository":"EvoRiseKsa/EvoOM-Guard-m","repository_id":"1293651176","target_commit_sha":"6bb4c328e56661b661e50532886802c6ba36a997","target_tree_sha":"bd81a595ca8608ad7da04390f31d5e489f5083ef","workflow_run_attempt":1,"workflow_run_id":"30701872897"}}
