{"context":{"candidate_sha256":"bd1c51a955072b5190083559b32413abce345732194ae4e11d5752b6ba65a9c4","format":"EVOGUARD_RELEASE_SOURCE_CONTEXT_V1","parent_commit_sha":"efb14217171138aacd4597dface4ca8517b0aebb","parent_tree_sha":"ae5da3e76a99ba018e1cd0a68c8f5541b5178b04","policy_sha256":"7a9e92aa27949c962066b089046892bda4bf26891ee1b3ac49b411a825dc61a9","protected_ref":"refs/heads/main","repository":"EvoRiseKsa/EvoOM-Guard-m","repository_id":"1293651176","run_attempt":1,"run_id":"31714267881","target_commit_sha":"d65f25f386fe6f4646ea8dd3cbbe1d5d889f73d4","target_tree_sha":"71657b2bde83701c95b66b60f37be1580423ad32","verifier_pack_sha256":"c129b33d647767db647906684fbfcc2ba834592a28b74ce4f02009984623ef43"},"format":"EVOGUARD_RELEASE_SOURCE_FINALIZER_HANDOFF_V1","record":{"sha256":"9de1179a271cd075186dde779aab1a5b5063f61a9e9f9214f2b3698d4ed11d96","size":9131},"source":{"default_branch":"main","protected_ref":"refs/heads/main","repository":"EvoRiseKsa/EvoOM-Guard-m","repository_id":"1293651176","target_commit_sha":"d65f25f386fe6f4646ea8dd3cbbe1d5d889f73d4","target_tree_sha":"71657b2bde83701c95b66b60f37be1580423ad32","workflow_run_attempt":1,"workflow_run_id":"31714267881"}}
